{
  "schemaVersion": "agent-town-generated-pack-v1",
  "packId": "gen_pack_1dc551d9ebea7769",
  "ownerAccountId": "owner_fixture",
  "createdAtMs": 1770000000000,
  "generator": {
    "id": "deterministic-world-grid-style-pack-v0.1",
    "source": "deterministic-fallback",
    "codexBridgeReady": true,
    "externalModelUsed": false,
    "futureModel": "gpt-image-2"
  },
  "prompt": {
    "hash": "fc691f03e258d9045748cde44e7177531cb5606bab85ac16752491867dc5ce4e",
    "length": 64,
    "keywordHints": [
      "cozy",
      "mushroom",
      "frontier",
      "clockwork",
      "gardeners",
      "lantern"
    ]
  },
  "generationBrief": {
    "schemaVersion": "agent-town-generation-brief-v1",
    "promptHash": "fc691f03e258d9045748cde44e7177531cb5606bab85ac16752491867dc5ce4e",
    "promptLength": 64,
    "keywordHints": [
      "cozy",
      "mushroom",
      "frontier",
      "clockwork",
      "gardeners",
      "lantern",
      "moss"
    ],
    "theme": {
      "primary": "Cozy Moss Lantern Frontier",
      "secondary": "Mushroom craft line",
      "setting": "Moss Lantern Frontier"
    },
    "tone": {
      "cozy": 0.85,
      "adventurous": 0.75,
      "mystical": 0.3,
      "humorous": 0.25,
      "serious": 0.35
    },
    "visualStyle": {
      "styleFamily": "warm mechanical frontier",
      "materialMotifs": [
        "grove",
        "grove",
        "moss lantern"
      ],
      "lighting": "warm daylight readability",
      "colorMood": "moss lantern frontier palette with high-contrast readable accents",
      "forbiddenVisuals": [
        "text in image",
        "logos",
        "credentials",
        "photoreal gore",
        "copyrighted characters"
      ]
    },
    "civilizationFlavor": {
      "species": [
        "Cozy settlers",
        "Mushroom crews"
      ],
      "factions": [
        "Cozy Settlers",
        "Mushroom Crews"
      ],
      "cultures": [
        "Moss Lantern Frontier craft tradition",
        "Mushroom route customs"
      ],
      "techFlavor": [
        "clockwork route markers",
        "hand-built civic machines",
        "copper repair tools"
      ]
    },
    "humorLevel": "subtle",
    "safety": {
      "status": "passed",
      "reasons": [],
      "normalizedForRuntime": true,
      "rawPromptExecutable": false
    }
  },
  "stylePack": {
    "schemaVersion": "agent-town-style-bible-v1",
    "stylePackId": "style_moss-lantern_1dc551d9",
    "promptHash": "fc691f03e258d9045748cde44e7177531cb5606bab85ac16752491867dc5ce4e",
    "name": "Cozy Moss Lantern Frontier",
    "themeSummary": "Cozy and Mushroom motifs translated into warm frontier materials.",
    "palette": {
      "background": "#e8eed0",
      "surface": "#fff6d8",
      "ink": "#25301f",
      "primary": "#446f45",
      "secondary": "#6f4260",
      "accent": "#d39a37",
      "focus": "#2f78ad",
      "selected": "#f1c75b",
      "light": "#fff4c9",
      "ambient": "#d7f0cf",
      "terrain": {
        "prairie": "#cfdc8c",
        "ridge": "#9f9271",
        "river": "#71a9b2",
        "forest": "#5f8d58",
        "mesa": "#c98252"
      },
      "state": {
        "claimed": "#d39a37",
        "claimable": "#5f8d58",
        "visible": "#cfdc8c",
        "locked": "#817b68"
      }
    },
    "materialRules": [
      {
        "target": "three-region-cell",
        "rule": "terrain colors are softened by ownership state"
      },
      {
        "target": "home-settlement-marker",
        "rule": "primary color with warm light contact shadow"
      },
      {
        "target": "selection-ring",
        "rule": "selected color with high contrast against terrain"
      }
    ],
    "silhouetteRules": [
      "buildings use one readable primary silhouette per canonical target",
      "terrain textures must remain legible under ownership overlays",
      "resource icons stay distinct at 32px"
    ],
    "uiRules": {
      "minReadableTextPx": 16,
      "onePrimaryAction": true,
      "normalGameplayDebugJargon": false
    },
    "animationRules": [
      "motion is cosmetic only",
      "reduced-motion mode may disable all ambient animation",
      "selection feedback must not obscure cell labels"
    ]
  },
  "universePack": {
    "schemaVersion": "agent-town-universe-bible-v1",
    "universePackId": "universe_1dc551d9ebea",
    "promptHash": "fc691f03e258d9045748cde44e7177531cb5606bab85ac16752491867dc5ce4e",
    "name": "Cozy Mushroom Charter",
    "pitch": "Cozy settlers and Mushroom crews build a civic frontier with Clover keeping the work bounded and legible.",
    "playerRole": "Cozy founder",
    "cloverRole": "Clover remains the trusted Foreman and explains each bounded action in-world.",
    "species": [
      {
        "id": "species_settlers",
        "name": "Cozy settlers",
        "description": "Readable frontier citizens who keep the settlement grounded in canonical Agent Town work."
      },
      {
        "id": "species_crews",
        "name": "Mushroom crews",
        "description": "Theme-flavored helpers who add presentation flavor without adding autonomous mechanics."
      }
    ],
    "factions": [
      {
        "factionId": "faction_settlers",
        "name": "Cozy Settlers",
        "role": "home-builders",
        "line": "They want cozy supplies and a steady route outward."
      },
      {
        "factionId": "faction_crews",
        "name": "Mushroom Crews",
        "role": "makers",
        "line": "They turn cozy timber and mushroom stone into practical town work."
      }
    ],
    "cultures": [
      {
        "cultureId": "culture_craft",
        "name": "Cozy craft habit",
        "civicHabit": "plan one route, explain the cost, then complete the bounded claim."
      },
      {
        "cultureId": "culture_route",
        "name": "Mushroom route custom",
        "civicHabit": "keep maps legible and make every generated label traceable to a canonical key."
      }
    ],
    "techs": [
      {
        "techId": "tech_route_signals",
        "name": "Mushroom Route Signals",
        "unlockIntent": "makes claim planning visually clearer"
      },
      {
        "techId": "tech_civic_lamps",
        "name": "Cozy Civic Lamps",
        "unlockIntent": "makes public works and night scenes readable"
      }
    ],
    "firstLoop": {
      "title": "Cozy first route",
      "objective": "Choose a nearby cell, plan the cozy route, and complete the first claim.",
      "successReceipt": "Cozy route complete. Cozy Hall now has a visible path into the wider territory.",
      "recovery": "If resources are short, pick another adjacent cell or keep the claim planned."
    },
    "text": {
      "topbarTitle": "Cozy World Grid",
      "statusReady": "Cozy survey ready",
      "packValidated": "Cozy pack validated",
      "planClaimAction": "Plan Cozy route",
      "completeClaimAction": "Complete Mushroom claim",
      "selectedSummaryPrefix": "Cozy survey note",
      "publicPresenceTitle": "Cozy Neighbors",
      "servicesTitle": "Mushroom Civic Services",
      "eventsTitle": "Cozy Public Works",
      "sandboxTitle": "Mushroom Sandbox District"
    }
  },
  "gameplayMapping": {
    "schemaVersion": "agent-town-gameplay-mapping-v1",
    "canonicalVersion": "agent-town-world-grid-v1",
    "serverRuleOverrides": 0,
    "canonicalEntities": [
      {
        "canonicalId": "building.hq",
        "mechanicalKey": "hq",
        "generatedName": "Cozy Hall",
        "assetHint": "tall civic lodge with one bright signal roof"
      },
      {
        "canonicalId": "building.worker_camp",
        "mechanicalKey": "worker_camp",
        "generatedName": "Mushroom Crew Camp",
        "assetHint": "compact worker camp with theme props and clear doorway"
      },
      {
        "canonicalId": "building.lumber_camp",
        "mechanicalKey": "lumber_camp",
        "generatedName": "Cozy Timber Yard",
        "assetHint": "wood-production building mapped to generated materials"
      },
      {
        "canonicalId": "building.farm",
        "mechanicalKey": "farm",
        "generatedName": "Cozy Garden Patch",
        "assetHint": "food-production building with readable planted rows"
      },
      {
        "canonicalId": "building.quarry",
        "mechanicalKey": "quarry",
        "generatedName": "Mushroom Stone Cut",
        "assetHint": "stone-production building with stable rock silhouette"
      },
      {
        "canonicalId": "building.market",
        "mechanicalKey": "market",
        "generatedName": "Mushroom Market Stand",
        "assetHint": "exchange building with cloth awning and signpost"
      },
      {
        "canonicalId": "resource.wood",
        "mechanicalKey": "wood",
        "generatedName": "Cozy Timber",
        "assetHint": "small stack icon"
      },
      {
        "canonicalId": "resource.stone",
        "mechanicalKey": "stone",
        "generatedName": "Mushroom Stone",
        "assetHint": "small stone icon"
      },
      {
        "canonicalId": "resource.food",
        "mechanicalKey": "food",
        "generatedName": "Cozy Supplies",
        "assetHint": "small crate icon"
      },
      {
        "canonicalId": "resource.coin",
        "mechanicalKey": "coin",
        "generatedName": "Mushroom Scrip",
        "assetHint": "small brass coin icon"
      },
      {
        "canonicalId": "character.clover",
        "mechanicalKey": "clover",
        "generatedName": "Clover Kincaid",
        "assetHint": "Clover remains the trusted Foreman silhouette"
      },
      {
        "canonicalId": "action.plan_claim",
        "mechanicalKey": "plan_claim",
        "generatedName": "Plan Cozy route",
        "assetHint": "primary claim planning action"
      },
      {
        "canonicalId": "action.complete_claim",
        "mechanicalKey": "complete_claim",
        "generatedName": "Complete Mushroom claim",
        "assetHint": "primary claim completion action"
      },
      {
        "canonicalId": "terrain.prairie",